### ISSUE TITLE
Feature Request: FLUSH support ?

### ISSUE THREAD

**Issue by TomGudman** [facette/facette#237]
Hi,

I can be wrong here but I could not make facette FLUSH[1] the graphs. 

A few things are confusing:
1. Is the 'daemon' parameter only for rrdcached or would that also work with the collectd unixsocket?
2. The documentation is somehow contradictory about how to define unix socket file in the configuration
3. Is there a way to see if facette can communicate properly with rrdcached __if__ facette supports the FLUSH command.

About the documentation and the daemon parameter, is it ```unix:///foo/bar```  or  ```unix:/foo/bar```
Extract from: http://docs.facette.io/configuration/ says ```UNIX socket using the unix://<absolute path> format, e.g. unix:///var/run/facette/facette.sock``` and the example in http://docs.facette.io/configuration/connectors/ shows only one slash after the colon.

**Comment by falzm** [comment]
Hi Tom

The `daemon` setting only support rrdcached.

Regarding the `unix://...` vs `unix:/`, it seems like you're confused between the **Facette backend** socket definition (from the base settings documented at http://docs.facette.io/configuration/) and the **rrd connector's** rrdcached setting, which accepts a value directly passed to the RRD binding (see http://oss.oetiker.ch/rrdtool/doc/rrdcached.en.html#I_l_address).

Let us know if you need more details.

**Comment by TomGudman** [comment]
Hi Marc,

Ok, the daemon only supports rrdcached. Cool, I do use rrdcached. So should I expect facette to send a flush for all the metrics I display in a graph or a collection of graphs? Right now, it is not flushing the graphs, I have to wait a bit less than 5min (our setup is ~ 300 hosts, ~50k metrics). It could be a rrdcached issue not just facette, I am new to rrdcached but it sounds rather easy to use.

##facette.json
```
{
	"bind": ":12003",
	"base_dir": "/usr/local/share/facette",
	"providers_dir": "/etc/facette/providers",
	"data_dir": "/var/lib/facette",
	"pid_file": "/var/run/facette/facette.pid",
	"daemon": "unix:///var/rrdtool/rrdcached/rrdcached.sock"
}
```
Note: it seems that one '/' or many does not change anything. I was asking just to ensure I am doing something wrong. 

##rrdcached
```rrdcached -l unix:/var/rrdtool/rrdcached/rrdcached.sock -s rrdcached -m 664 -b /var/lib/collectd/rrd -g```

**Comment by falzm** [comment]
Yes, it's supposed to do so – at least, it does on my setup ;)

I think the problem comes from your configuration: it should be

    "daemon": "unix:/var/rrdtool/rrdcached/rrdcached.sock"

Can you try and confirm?

**Comment by TomGudman** [comment]
As said, one slash or many slashes work the same way as far as I can see.
Well, It does not seem to work for me, it must be PEBKAC somewhere, I will figure out.
FLUSH is supported that's what I wanted to know.

**Comment by TomGudman** [comment]
Hey,

I do not think this works, at least with my current setup. I did try many things (from scratch) and I cannot see what's wrong. 
- I am running facette 0.4-dev-c36c7f27fa
- rrdcached is from rrdtool version 1.4.7
- collectd 5.5.0 (interval is 10sec)
- collectd writes to rrdcached fine. RRD are created. Facette can read the RRD files 
- rrdcached has a socket open: /var/rrdtool/rrdcached/rrdcached.sock
- all daemons run as root.
- facette has: "daemon": "unix:/var/rrdtool/rrdcached/rrdcached.sock"

__BUT__

When I display a graph I am missing the last 3 to 5min (I guess depending on when rrdcached wrote the RRD last). If I run:  ```rrdtool flushcached --daemon /var/rrdtool/rrdcached/rrdcached.sock /var/rrdtool/rrdcached/foo/bar.rrd```, it does flush fine the RRD and suddently I can see the last values in facette. So what's wrong and what's the best way to debug this? Back to square one.
I do not think it's a PEBKAC anymore or I have tunnel vision.

**Comment by TomGudman** [comment]
I am happy to apply a patch to see the flush command sent through the socket if there is no debug available.

**Comment by vbatoufflet** [comment]
Hi Tom,

Setting the `daemon` parameter in the provider configuration makes Facette passing it to the various calls in the `rrd` package we use in the connector:

https://github.com/facette/facette/blob/master/pkg/connector/rrd.go#L88-L90

For example it should result in executing something similar to:
```
rrdtool xport --daemon unix:/var/run/rrdcached.sock ...
```
Asking to the RRD library to flush the data before retrieving it.

Is there any error or warning in the logs?

There is no specific debugging capabilities in the [ziutek/rrd](https://github.com/ziutek/rrd) package. I will take a look to see if we can manage to had some

**Comment by TomGudman** [comment]
Hi Vincent,

> Is there any error or warning in the logs?
I will reconfirm that but last week I did not see any by running facette 
-l /tmp/debug -L debug

> There is no specific debugging capabilities in the ziutek/rrd
> <https://github.com/ziutek/rrd> package. I will take a look to see if we
> can manage to had some
Yes, I found that too. However, it was impossible to me to 'manually 
regenerate the rrd command it executes ;-) I thought I could just add a 
debug line to display the rrdtool command it runs to also run it 
manually. I agree that based on 'man rrdxport' the above should work.

        --daemon address
            Address of the rrdcached daemon. If specified, a "flush"
            command is sent to the server before reading the RRD files.
            This allows rrdtool to return fresh data even if the daemon
            is configured to cache values for a long time.  For a list
            of accepted formats, see the -l option in the rrdcached
            manual.

              rrdtool xport --daemon unix:/var/run/rrdcached.sock ...

If you could find an easy way to display a few debug log messages for 
the rrd go module without wasting too much of your time, that would be 
much appreciated.

Thanks

**Comment by vbatoufflet** [comment]
FYI,

If something goes wrong with `rrdcached` calls, the logs should tell you.

Examples of error messages:
```
ERROR: server: Unable to connect to rrdcached: No such file or directory
ERROR: server: Unable to connect to rrdcached: Permission denied
ERROR: server: rrdc_flush (/var/lib/collectd/rrd/host1.example.net/load/load.rrd) failed with status -3.
```

**Comment by vbatoufflet** [comment]
Tom,

I made a small patch in order to print some debug from the RRD library: [facette-rrd_debug.patch](https://gist.github.com/vbatoufflet/075743ac23697ea6e7a8).

It can be applied by running:

```
patch -p1 <facette-rrd_debug.patch
```

It should print some debug, like:
```
>>> "xport -s 1438058053 -e 1438061653 --step 10 --daemon unix:/var/rrdtool/rrdcached/rrdcached.sock DEF:series0-def0=/var/lib/collectd/rrd/host1.example.net/load/load.rrd:shortterm:AVERAGE CDEF:series0=series0-def0 XPORT:series0:series0 DEF:series1-def0=/var/lib/collectd/rrd/host1.example.net/load/load.rrd:midterm:AVERAGE CDEF:series1=series1-def0 XPORT:series1:series1 DEF:series2-def0=/var/lib/collectd/rrd/host1.example.net/load/load.rrd:longterm:AVERAGE CDEF:series2=series2-def0 XPORT:series2:series2"
```

**Comment by TomGudman** [comment]
Hi Vincent,

> |ERROR: server: Unable to connect to rrdcached: No such file or directory
> ERROR: server: Unable to connect to rrdcached: Permission denied
> ERROR: server: rrdc_flush (/var/lib/collectd/rrd/host1.example.net/load/load.rrd) failed with status -3.
No errors in the log (facette -L debug -l /tmp/TOM).
I will try the patch. Thanks for creating the patch that quickly.

Thomas

**Comment by TomGudman** [comment]
On 28/07/15 15:37, Vincent Batoufflet wrote:
> Tom,
>
> I made a small patch in order to print some debug from the RRD library:
> facette-rrd_debug.patch
> <https://gist.github.com/vbatoufflet/075743ac23697ea6e7a8>.
>
> It can be applied by running:
>
> |patch -p1 <facette-rrd_debug.patch
> |
>
> It should print some debug, like:
>
> |>>> "xport -s 1438058053 -e 1438061653 --step 10 --daemon unix:/var/rrdtool/rrdcached/rrdcached.sock DEF:series0-def0=/var/lib/collectd/rrd/host1.example.net/load/load.rrd:shortterm:AVERAGE CDEF:series0=series0-def0 XPORT:series0:series0 DEF:series1-def0=/var/lib/collectd/rrd/host1.example.net/load/load.rrd:midterm:AVERAGE CDEF:series1=series1-def0 XPORT:series1:series1 DEF:series2-def0=/var/lib/collectd/rrd/host1.example.net/load/load.rrd:longterm:AVERAGE CDEF:series2=series2-def0 XPORT:series2:series2"
>

Interestingly enough no -daemon ...

# facette -L debug -l /tmp/TOM
[..]
 >>> "xport -s 1438064326 -e 1438067926 --step 10 
DEF:series0-def0=/var/lib/collectd/rrd/lns.bne.domain.tld/lns/lns_sessions.rrd:sessions:AVERAGE 
CDEF:series0=series0-def0 XPORT:series0:series0 
DEF:series1-def0=/var/lib/collectd/rrd/lns1-c2.bne.domain.tld/lns/lns_sessions.rrd:sessions:AVERAGE 
CDEF:series1=series1-def0 XPORT:series1:series1"
 >>> "xport -s 1438064326 -e 1438067926 --step 10 
DEF:series0-def0=/var/lib/collectd/rrd/lns.mel.domain.tld/lns/lns_sessions.rrd:sessions:AVERAGE 
CDEF:series0=series0-def0 XPORT:series0:series0 
DEF:series1-def0=/var/lib/collectd/rrd/lns1-c2.mel.domain.tld/lns/lns_sessions.rrd:sessions:AVERAGE 
CDEF:series1=series1-def0 XPORT:series1:series1"
 >>> "xport -s 1438064326 -e 1438067926 --step 10 
DEF:series0-def0=/var/lib/collectd/rrd/lns.syd.domain.tld/lns/lns_sessions.rrd:sessions:AVERAGE 
CDEF:series0=series0-def0 XPORT:series0:series0 
DEF:series1-def0=/var/lib/collectd/rrd/lns1-c2.syd.domain.tld/lns/lns_sessions.rrd:sessions:AVERAGE 
CDEF:series1=series1-def0 XPORT:series1:series1"
 >>> "xport -s 1438064340 -e 1438067940 --step 10 
DEF:series0-def0=/var/lib/collectd/rrd/lns.bne.domain.tld/lns/lns_sessions.rrd:sessions:AVERAGE 
CDEF:series0=series0-def0 XPORT:series0:series0 
DEF:series1-def0=/var/lib/collectd/rrd/lns1-c2.bne.domain.tld/lns/lns_sessions.rrd:sessions:AVERAGE 
CDEF:series1=series1-def0 XPORT:series1:series1 
DEF:series2-def0=/var/lib/collectd/rrd/lns.mel.domain.tld/lns/lns_sessions.rrd:sessions:AVERAGE 
CDEF:series2=series2-def0 XPORT:series2:series2 
DEF:series3-def0=/var/lib/collectd/rrd/lns1-c2.mel.domain.tld/lns/lns_sessions.rrd:sessions:AVERAGE 
CDEF:series3=series3-def0 XPORT:series3:series3 
DEF:series4-def0=/var/lib/collectd/rrd/lns.syd.domain.tld/lns/lns_sessions.rrd:sessions:AVERAGE 
CDEF:series4=series4-def0 XPORT:series4:series4 
DEF:series5-def0=/var/lib/collectd/rrd/lns1-c2.syd.domain.tld/lns/lns_sessions.rrd:sessions:AVERAGE 
CDEF:series5=series5-def0 XPORT:series5:series5"
[..]

# cat /etc/facette/facette.json
{
	"bind": ":12003",
	"base_dir": "/usr/local/share/facette",
	"providers_dir": "/etc/facette/providers",
	"data_dir": "/var/lib/facette",
	"pid_file": "/var/run/facette/facette.pid",
	"daemon": "unix:/var/rrdtool/rrdcached/rrdcached.sock"
}

Note: spaces are <tabs> in my config in case this could create an issue.

# ls -l /var/rrdtool/rrdcached/rrdcached.sock
srwxr-xr-x 1 root root 0 Jul 28 11:32 /var/rrdtool/rrdcached/rrdcached.sock

So what does read the 'daemon' param and pass it to the RRD library?

**Comment by vaab** [comment]
Same issue here... Applied your patch, nothing really new since @TomGudman post:

```
>>> "xport -s 1438095672 -e 1438099272 --step 10 --daemon collectd:42217 DEF:series0-def0=/var/lib/rrdcached/db/collectd/collectd/load/load.rrd:shortterm:AVERAGE CDEF:series0=series0-def0 XPORT:series0:series0"
2015/07/28 16:01:12 ERROR: server: rrdc_flush (/var/lib/rrdcached/db/collectd/collectd/load/load.rrd) failed with status -1.
```

With a netcat from facette host:

```
$ netcat collectd 42217
FLUSH /var/lib/rrdcached/db/collectd/collectd/load/load.rrd
0 Successfully flushed /var/lib/rrdcached/db/collectd/collectd/load/load.rrd.
```

I get some communication from facette host coming to rrdcached host's port 42217 upon starting facette, but not when generating this error... (using Ctrl-R on a graph in facette web interface) this is weird.

Note that the captured communication is only a SYN/SYNACK/ACK when facette launches, and a FIN/FINACK/ACK upon facette exit (with Ctrl-C for instance). Could you be opening the correct connection and not using it ?

**Comment by vbatoufflet** [comment]
Tom, Valentin,

Which OS and RRDtool version are you using?

**Comment by falzm** [comment]
Are you running Facette in a Docker container?

**Comment by TomGudman** [comment]
Hey guys,

- Vincent:  Centos 6.6 with rrdtool 1.4.7, see build log at the end.
- Marc: No, I would like to avoid. After facette is made of 2 binaries and a config file. 
- Valentin: Note that your problem seems slightly different than mine. We can see the -daemon in your xport log lines whereas we cannot in mine. I would recommend using a FQDN or eventually try an IP (to remove any name resolution problem). 

The question is why -daemon is not passed to the rrd library? Can facette dump the config on start?
It sounds to me this is not an OS nor a RRDtool issue but something within facette code or the rrd library. 

We have our own instance of koji at work (RPM factory used in Fedora to build). We built our own RRDtool 1.4.7 and facette RPM with NodeJS packages. As said everything works fine. I have facette running successfully via a RPM except this flush thing. Once solved, I will PR the spec file (equivalent of Debian 'rules') and instructions so other can build facette without the use of docker.

```
[..]
DEBUG util.py:257:  Installing:
DEBUG util.py:257:   golang                       x86_64 1.4.2-2.el6                    build 3.0 M
DEBUG util.py:257:   nodejs-bundle-jshint         noarch 2.8.0-1.el6                    build 803 k
DEBUG util.py:257:   nodejs-bundle-less           noarch 2.5.1-1.el6                    build 1.3 M
DEBUG util.py:257:   nodejs-bundle-less-plugin-clean-css
DEBUG util.py:257:                                noarch 1.5.0-1.el6                    build 130 k
DEBUG util.py:257:   nodejs-bundle-uglify-js      noarch 2.4.8-1.el6                    build 190 k
DEBUG util.py:257:   npm                          noarch 1.3.6-5.el6                    build 329 k
DEBUG util.py:257:   pandoc                       x86_64 1.9.4.1-1.1.el6                build 1.1 M
DEBUG util.py:257:   rrdtool-devel                x86_64 1.4.7-1.el6.iseek              build 197 k
[..]
+ cd facette.git-0.4
+ /bin/chmod -Rf a+rX,u+w,g-w,o-w .
Patch #1 (facette-powerwalk_removal.patch):
+ echo 'Patch #1 (facette-powerwalk_removal.patch):'
+ /bin/cat /builddir/build/SOURCES/facette-powerwalk_removal.patch
+ /usr/bin/patch -p1 --fuzz=0
patching file pkg/utils/os.go
Patch #2 (facette-rrd_debug.patch):
+ echo 'Patch #2 (facette-rrd_debug.patch):'
+ /bin/cat /builddir/build/SOURCES/facette-rrd_debug.patch
+ /usr/bin/patch -p1 --fuzz=0
patching file vendor/src/github.com/ziutek/rrd/rrd_c.go
Executing(%build): /bin/sh -e /var/tmp/rpm-tmp.HwmDSI
+ exit 0
+ umask 022
+ cd /builddir/build/BUILD
+ cd facette.git-0.4
+ LANG=C
+ export LANG
+ unset DISPLAY
+ make PREFIX=/builddir/build/BUILDROOT/facette-0.4-c36c7f27fa.2.el6.iseek.x86_64/usr/local
main: Preparing source paths...
result: ok
facette: Building facette...
result: ok
facettectl: Building facettectl...
result: ok
docs: Generating facette.1 manual page...
result: ok
docs: Generating facettectl.8 manual page...
result: ok
static: Merging script files into facette.src.js...
result: ok
static: Packing facette.src.js file...
result: ok
static: Copying third-party files...
result: ok
static: Packing cmd/facette/js/messages.json file...
result: ok
static: Merging style files into style.src.css...
result: ok
static: Packing style.src.css file...
result: ok
static: Merging style files into style.print.src.css...
result: ok
static: Packing style.print.src.css file...
result: ok
static: Copying extra files...
result: ok
build: Copying template files...
result: ok
+ exit 0
```

**Comment by vaab** [comment]
In my setup, ``facette`` is in a docker, and I use volumes (-v) to give access to RRD files, and set configuration directory. All this obviously works as I get fancy (but not up to date) graphics when I remove the ``daemon`` option.

To my opinion, FQDN have nothing to envy to non-FQDN especially in a setup where ``netcat`` (and ping) shows that everything goes well name-resolution speaking. And I must stress again that a TCP connection to the correct host is setup on ``facette`` launch and teared down upon quitting. However I tried with an IP without any change.

However, I think I found the culprit: when in non-socket mode, absolute path for file names are not supported (but only relative to base path of rrdcached). But ``facette`` keeps sending ``path`` that is provided in the configuration and it waits to find the given file in its own file system in the same path (and relative paths on local file system are relative to the current working directory of the ``facette`` process in the docker).

**Comment by vaab** [comment]
Set path to "" or "/" or "." leaded to very strange behavior in sources detection from ``facette``.

**Comment by vaab** [comment]
Should I move all this to a new thread in a separate bug ?

**Comment by TomGudman** [comment]
The IP or FQDN suggestion was just to test facette resolution. I agree that with your test using 'collectd' look fine but you dunno how facette would handle it. Anyway, can you elaborate your possible solution to your problem because it is fairly vague without context. Even though I believe it will not solve my problem I am curious and maybe other readers may beneficiate of your more detailed answer.

**Comment by vaab** [comment]
Here's what I understand:

Working on ``facette`` host, starting from the lowest level:
- direct ``netcat`` connection with command ``FLUSH`` and full absolute path works fine. This part is only responsible for flushing rrdcached info towards this file and have it contain the last measures. This never directly reads any rrd on the filesystem of ``facette``, it passes the location to the daemon through the wire, and the daemon on the other side will use this path to locate the file.
```
# netcat rrdcache-host 42217
FLUSH /var/lib/rrdcached/db/zen/snmp/cpu-docker-9d2f99c7dea1.rrd
0 Successfully flushed /var/lib/rrdcached/db/zen/snmp/cpu-docker-9d2f99c7dea1.rrd.
```

- ``xprov`` is meant to read a rrd file *directly on the local filesystem* while having the option to ask ``rrdcache`` daemon to flush any pending content to this file with the previous network/socket command (option ``--daemon DAEMON``). The local path and the one sent to ``rrdcache`` must match a valid file in the local filesystem *and* on ``rrdcache-host``. Notice that first, if ``--daemon`` was set,  ``xprov`` should send the given path to ``rrdcache-host`` as shown in the previous part. But actually, if your daemon address is a remote host and not a file socket, it will fail on absolute paths (it'll connect to the host, but won't send the flush command at all), it will *only support relative path* (without the leading "/"). You can check that with ``tcpdump``:
  With absolute path:
```
# rrdtool xport -s 1438118289 -e 1438121889 --step 10 --daemon 10.0.3.73 DEF:series0-def0=/var/lib/rrdcached/db/zen/snmp/cpu-docker-9d2f99c7dea1.rrd:value:AVERAGE CDEF:series0=series0-def0 XPORT:series0:series0
ERROR: rrdc_flush (/var/lib/rrdcached/db/zen/snmp/cpu-docker-9d2f99c7dea1.rrd) failed with status -1.
```
The corresponding tcpdump trace shows only opening/close of the TCP session.:
```
8:29:03.870274 IP 10.0.3.1.40666 > collectd.42217: Flags [S], seq 313425351, win 29200, options [mss 1460,sackOK,TS val 43252343 ecr 0,nop,wscale 7], length 0
08:29:03.870308 IP collectd.42217 > 10.0.3.1.40666: Flags [S.], seq 1170406028, ack 313425352, win 28960, options [mss 1460,sackOK,TS val 43252343 ecr 43252343,nop,wscale 7], length 0
08:29:03.870350 IP 10.0.3.1.40666 > collectd.42217: Flags [.], ack 1, win 229, options [nop,nop,TS val 43252343 ecr 43252343], length 0
08:29:03.871294 IP 10.0.3.1.40666 > collectd.42217: Flags [F.], seq 1, ack 1, win 229, options [nop,nop,TS val 43252344 ecr 43252343], length 0
08:29:03.871342 IP collectd.42217 > 10.0.3.1.40666: Flags [F.], seq 1, ack 2, win 227, options [nop,nop,TS val 43252344 ecr 43252344], length 0
08:29:03.871394 IP 10.0.3.1.40666 > collectd.42217: Flags [.], ack 2, win 229, options [nop,nop,TS val 43252344 ecr 43252344], length 0
```
   With relative path (even bogus):
```
# rrdtool xport -s 1438118289 -e 1438121889 --step 10 --daemon 10.0.3.73 DEF:series0-def0=toto:value:AVERAGE CDEF:series0=series0-def0 XPORT:series0:series0
ERROR: rrdc_flush (toto) failed with status -1.
```
The tcpdump trace shows the server is exchanging information with collectd:
```
08:30:49.176923 IP 10.0.3.1.40698 > collectd.42217: Flags [S], seq 2452683089, win 29200, options [mss 1460,sackOK,TS val 43278670 ecr 0,nop,wscale 7], length 0
08:30:49.176942 IP collectd.42217 > 10.0.3.1.40698: Flags [S.], seq 2195590071, ack 2452683090, win 28960, options [mss 1460,sackOK,TS val 43278670 ecr 43278670,nop,wscale 7], length 0
08:30:49.176962 IP 10.0.3.1.40698 > collectd.42217: Flags [.], ack 1, win 229, options [nop,nop,TS val 43278670 ecr 43278670], length 0
08:30:49.176998 IP 10.0.3.1.40698 > collectd.42217: Flags [P.], seq 1:12, ack 1, win 229, options [nop,nop,TS val 43278670 ecr 43278670], length 11
08:30:49.177003 IP collectd.42217 > 10.0.3.1.40698: Flags [.], ack 12, win 227, options [nop,nop,TS val 43278670 ecr 43278670], length 0
08:30:49.177047 IP collectd.42217 > 10.0.3.1.40698: Flags [P.], seq 1:46, ack 12, win 227, options [nop,nop,TS val 43278670 ecr 43278670], length 45
08:30:49.177100 IP 10.0.3.1.40698 > collectd.42217: Flags [.], ack 46, win 229, options [nop,nop,TS val 43278670 ecr 43278670], length 0
08:30:49.177473 IP 10.0.3.1.40698 > collectd.42217: Flags [F.], seq 12, ack 46, win 229, options [nop,nop,TS val 43278670 ecr 43278670], length 0
08:30:49.177489 IP collectd.42217 > 10.0.3.1.40698: Flags [F.], seq 46, ack 13, win 227, options [nop,nop,TS val 43278670 ecr 43278670], length 0
08:30:49.177510 IP 10.0.3.1.40698 > collectd.42217: Flags [.], ack 47, win 229, options [nop,nop,TS val 43278670 ecr 43278670], length 0
```
We can notice a PUSH from both side, and here's the content:

```
08:36:46.123111 IP 10.0.3.1.40795 > collectd.42217: Flags [P.], seq 1:12, ack 1, win 229, options [nop,nop,TS val 43367906 ecr 43367906], length 11
E..?..@.?..z
...
..I.[..@.8.W........{.....
........flush toto

08:36:46.123181 IP collectd.42217 > 10.0.3.1.40795: Flags [P.], seq 1:46, ack 12, win 227, options [nop,nop,TS val 43367906 ecr 43367906], length 45
E..a<.@.@..b
..I
......[W...@.8............
........-1 No such file: /var/lib/rrdcached/db/toto.
```
You can see that the bogus relative file ``toto`` was looked up in ``/var/lib/rrdcached/db/`` which is the data-dir of ``rrdcached`` (set with ``-b`` option on ``rrdcached`` command line).

So we can see that ``xprov`` do not support correctly absolute paths when using a non-socket daemon.

All this is independant from facette, but I guess this is meant to be like this.

``facette`` could work even with this seemingly bogus behavior.

This is why I started to try relative paths as the ``path`` in the ``connector`` part of ``providers`` configuration. I noticed:
- ``facette`` then use the CWD of the process as base (this should be changed).
- values as ``.`` seems to mess with the regular expression used to infer source names.
- using other values gives many weird (bad) answers: 
    - ``..`` seems to make it go along a infinite recursive call, 
    - ``../db`` will cast:
```
2015/07/29 06:45:51 ERROR: provider: collectd-local: unable to refresh: lstat ../etc/modules-load.d/../modules: no such file or directory
```
    - empty value will cast:
```
2015/07/29 06:51:06 ERROR: provider: collectd-local: unable to refresh: stat : no such file or directory
```

This makes me think that it seems this ``path`` variable is used in too many places.

Was I clearer ?

**Comment by vbatoufflet** [comment]
@vaab, I'm not sure that the issue is identical.

@TomGudman, if you want to print some debug for RRD connector settings you can try the [facette-rrd_settings_debug.patch](https://gist.github.com/vbatoufflet/7b0f38c7e6cc8e607a4d) patch.

It should print something like:
```
>>> settings: map[type:rrd path:/srv/collectd/rrd pattern:(?P<source>[^/]+)/(?P<metric>.+).rrd daemon:unix:/var/rrdtool/rrdcached/rrdcached.sock _id:5296dcbc-bd70-4053-7901-3faf2d0b2d49]
>>> connector: &{name:collectd path:/srv/collectd/rrd daemon:unix:/var/rrdtool/rrdcached/rrdcached.sock re:<nil> metrics:map[]}
```

**Comment by TomGudman** [comment]
Hi Vincent,

Thanks for the patch.
I have rebuilt facette with your patch...
It looks like daemon is set to nil... as we could have expected because 
we could not see it the output of your previous rrd 'xport' patch.

# cat /etc/facette/facette.json
{
	"bind": ":12003",
	"base_dir": "/usr/local/share/facette",
	"providers_dir": "/etc/facette/providers",
	"data_dir": "/var/lib/facette",
	"pid_file": "/var/run/facette/facette.pid",
	"daemon": "unix:/var/rrdtool/rrdcached/rrdcached.sock"
}

# facette -L debug -l /tmp/TOM -c /etc/facette/facette.json
 >>> settings: map[type:rrd path:/var/lib/collectd/rrd 
pattern:(?P<source>[^/]+)/(?P<metric>.+).rrd 
_id:bf373bfb-e6d5-4cf7-6282-2148395e0800]
 >>> connector: &{name:collectd path:/var/lib/collectd/rrd daemon: 
re:<nil> metrics:map[]}


- git_version c36c7f27fa
- Patch1: facette-powerwalk_removal.patch
- Patch2: facette-rrd_debug.patch
- Patch3: facette-rrd_settings_debug.patch

**Comment by TomGudman** [comment]
Hi vaab,

Nice and clear explanation. I assume ```xprov``` is a typo for ```xport```. In your case what you would need is that facette:
- detects the type of socket based on the daemon: option (local or remote)
- if non local socket then it should substract the providers rrd_path to only send a relative paths to rrdcached but still use the full path in case it needs to read something locally.

It sounds to me this is a fair bit of work

**Comment by TomGudman** [comment]
and yes it is clearly a different problem ;-) Maybe you could create a new issue if required.

**Comment by vbatoufflet** [comment]
@TomGudman. Looking exactly at what you provided us with, I think I figured out want happened.

The `daemon` parameter is a connector setting, so it must be configured in the provider file, not in the main `facette.json` configuration file :wink: 

Please see http://docs.facette.io/configuration/connectors/ for details.

**Comment by vaab** [comment]
@TomGudman I've created 2 separate issues (as the behavior with unsane ``path`` values is preoccupying also). #239 and #240 

I don't think both of these is a big issue: I manage to tackle #239 by launching ``facette`` in the base dir and providing a very strange path: ``./././.`` in the configuration file. I have to do this only because some strange things are made with the path and generate many critical bugs #240 

From now on I'll write on these 2 issues.

**Comment by TomGudman** [comment]
Raaaaaaaaaaaaaaaaaaaaaaaaaaaaaaaaaaaaaaaaaaaaaaaaaaaaaaaaaaaaaaaaaaaaaaaaaaaaaah. What an idiot I am! It is crystal clear in the doco, I had it open many times. Tunnel vision.

Guys, I am so so sorry for the waste of time and hassle I generated, anyway many thanks for your help. Allright, I can now close my github account and create a new one - ashamed ;-)

Resolving. 
Answer is: "The daemon parameter is a connector setting, so it must be configured in the provider file, not in the main facette.json configuration file". Thanks again @vbatoufflet for spotting that!
