### ISSUE TITLE
rrdcached non-socket daemon support broken

### ISSUE THREAD

**Issue by vaab** [facette/facette#239]
There's a nasty bug around using the `daemon` option when using a non-socket address. This prevents it to be used.

Additionaly, and related, setting `path` to different relative values will trigger nasty bugs in `facette`.

What follows is a setup, and debug session I made that explain in details this issue:

Using docker on `facette` side, and `rrdtool` version  `1.4.8-1.2ubuntu1` on the `rrdcache-host`.

Working on `facette` host, starting from the lowest level:
- direct `netcat` connection with command `FLUSH` and full absolute path works fine. This part is only responsible for flushing rrdcached info towards this file and have it contain the last measures. This never directly reads any rrd on the filesystem of `facette`, it passes the location to the daemon through the wire, and the daemon on the other side will use this path to locate the file.

```
# netcat rrdcache-host 42217
FLUSH /var/lib/rrdcached/db/zen/snmp/cpu-docker-9d2f99c7dea1.rrd
0 Successfully flushed /var/lib/rrdcached/db/zen/snmp/cpu-docker-9d2f99c7dea1.rrd.
```
- `xport` is meant to read a rrd file _directly on the local filesystem_ while having the option to ask `rrdcache` daemon to flush any pending content to this file with the previous network/socket command (option `--daemon DAEMON`). The local path and the one sent to `rrdcache` must match a valid file in the local filesystem _and_ on `rrdcache-host`. Notice that first, if `--daemon` was set,  `xprov` should send the given path to `rrdcache-host` as shown in the previous part. But actually, if your daemon address is a remote host and not a file socket, it will fail on absolute paths (it'll connect to the host, but won't send the flush command at all), it will _only support relative path_ (without the leading "/"). You can check that with `tcpdump`:
  With absolute path:

```
# rrdtool xport -s 1438118289 -e 1438121889 --step 10 --daemon 10.0.3.73 DEF:series0-def0=/var/lib/rrdcached/db/zen/snmp/cpu-docker-9d2f99c7dea1.rrd:value:AVERAGE CDEF:series0=series0-def0 XPORT:series0:series0
ERROR: rrdc_flush (/var/lib/rrdcached/db/zen/snmp/cpu-docker-9d2f99c7dea1.rrd) failed with status -1.
```

The corresponding tcpdump trace shows only opening/close of the TCP session.:

```
8:29:03.870274 IP 10.0.3.1.40666 > collectd.42217: Flags [S], seq 313425351, win 29200, options [mss 1460,sackOK,TS val 43252343 ecr 0,nop,wscale 7], length 0
08:29:03.870308 IP collectd.42217 > 10.0.3.1.40666: Flags [S.], seq 1170406028, ack 313425352, win 28960, options [mss 1460,sackOK,TS val 43252343 ecr 43252343,nop,wscale 7], length 0
08:29:03.870350 IP 10.0.3.1.40666 > collectd.42217: Flags [.], ack 1, win 229, options [nop,nop,TS val 43252343 ecr 43252343], length 0
08:29:03.871294 IP 10.0.3.1.40666 > collectd.42217: Flags [F.], seq 1, ack 1, win 229, options [nop,nop,TS val 43252344 ecr 43252343], length 0
08:29:03.871342 IP collectd.42217 > 10.0.3.1.40666: Flags [F.], seq 1, ack 2, win 227, options [nop,nop,TS val 43252344 ecr 43252344], length 0
08:29:03.871394 IP 10.0.3.1.40666 > collectd.42217: Flags [.], ack 2, win 229, options [nop,nop,TS val 43252344 ecr 43252344], length 0
```

   With relative path (even bogus):

```
# rrdtool xport -s 1438118289 -e 1438121889 --step 10 --daemon 10.0.3.73 DEF:series0-def0=toto:value:AVERAGE CDEF:series0=series0-def0 XPORT:series0:series0
ERROR: rrdc_flush (toto) failed with status -1.
```

The tcpdump trace shows the server is exchanging information with collectd:

```
08:30:49.176923 IP 10.0.3.1.40698 > collectd.42217: Flags [S], seq 2452683089, win 29200, options [mss 1460,sackOK,TS val 43278670 ecr 0,nop,wscale 7], length 0
08:30:49.176942 IP collectd.42217 > 10.0.3.1.40698: Flags [S.], seq 2195590071, ack 2452683090, win 28960, options [mss 1460,sackOK,TS val 43278670 ecr 43278670,nop,wscale 7], length 0
08:30:49.176962 IP 10.0.3.1.40698 > collectd.42217: Flags [.], ack 1, win 229, options [nop,nop,TS val 43278670 ecr 43278670], length 0
08:30:49.176998 IP 10.0.3.1.40698 > collectd.42217: Flags [P.], seq 1:12, ack 1, win 229, options [nop,nop,TS val 43278670 ecr 43278670], length 11
08:30:49.177003 IP collectd.42217 > 10.0.3.1.40698: Flags [.], ack 12, win 227, options [nop,nop,TS val 43278670 ecr 43278670], length 0
08:30:49.177047 IP collectd.42217 > 10.0.3.1.40698: Flags [P.], seq 1:46, ack 12, win 227, options [nop,nop,TS val 43278670 ecr 43278670], length 45
08:30:49.177100 IP 10.0.3.1.40698 > collectd.42217: Flags [.], ack 46, win 229, options [nop,nop,TS val 43278670 ecr 43278670], length 0
08:30:49.177473 IP 10.0.3.1.40698 > collectd.42217: Flags [F.], seq 12, ack 46, win 229, options [nop,nop,TS val 43278670 ecr 43278670], length 0
08:30:49.177489 IP collectd.42217 > 10.0.3.1.40698: Flags [F.], seq 46, ack 13, win 227, options [nop,nop,TS val 43278670 ecr 43278670], length 0
08:30:49.177510 IP 10.0.3.1.40698 > collectd.42217: Flags [.], ack 47, win 229, options [nop,nop,TS val 43278670 ecr 43278670], length 0
```

We can notice a PUSH from both side, and here's the content:

```
08:36:46.123111 IP 10.0.3.1.40795 > collectd.42217: Flags [P.], seq 1:12, ack 1, win 229, options [nop,nop,TS val 43367906 ecr 43367906], length 11
E..?..@.?..z
...
..I.[..@.8.W........{.....
........flush toto

08:36:46.123181 IP collectd.42217 > 10.0.3.1.40795: Flags [P.], seq 1:46, ack 12, win 227, options [nop,nop,TS val 43367906 ecr 43367906], length 45
E..a<.@.@..b
..I
......[W...@.8............
........-1 No such file: /var/lib/rrdcached/db/toto.
```

You can see that the bogus relative file `toto` was looked up in `/var/lib/rrdcached/db/` which is the data-dir of `rrdcached` (set with `-b` option on `rrdcached` command line).

So we can see that `xport` do not support correctly absolute paths when using a non-socket daemon.

All this is independant from facette, but I guess this is meant to be like this (as it is "documented" in the source code of rrdtools: https://github.com/oetiker/rrdtool-1.x/blob/1.4/src/rrd_client.c#L65-L68 )

`facette` could work even with this seemingly bogus behavior.

This is why I started to try relative paths as the `path` in the `connector` part of `providers` configuration. I noticed:
- `facette` then use the CWD of the process as base (this should be changed).
- values as `.` seems to mess with the regular expression used to infer source names.
- using other values gives many weird (bad) answers: 
  - `..` seems to make it go along a infinite recursive call, 
  - `../db` will cast:

```
2015/07/29 06:45:51 ERROR: provider: collectd-local: unable to refresh: lstat ../etc/modules-load.d/../modules: no such file or directory
```
- empty value will cast:

```
2015/07/29 06:51:06 ERROR: provider: collectd-local: unable to refresh: stat : no such file or directory
```

This makes me think that it seems this `path` variable is used in too many places.

**Comment by vaab** [comment]
The first post might not be very clear if taken out of the blue like this. It is related to #237 where I had to figure why FLUSH didn't work on my setup.

This issue is primarily upon supporting FLUSH on non-socket daemons.

**Comment by vaab** [comment]
I managed to get around this bug by playing with the ``path`` and providing relative paths that are not hit by: #240
I launch ``facette`` from the same directory where I have all my rrds, and set path to ``./././.``. I have no idea why this value works and not ``.`` ...

**Comment by vaab** [comment]
The correction for this should be quite straightforward:
upon ``xport`` creation:
- if using socket, provide full path
- if using non-socket, provide relative path

Is it something that should be corrected in https://github.com/ziutek/rrd/issues ?

**Comment by vbatoufflet** [comment]
Valentin,

Looking at the output you pasted above:
```
rrdtool xport -s 1438118289 -e 1438121889 --step 10 --daemon 10.0.3.73 DEF:series0-def0=/var/lib/rrdcached/db/zen/snmp/cpu-docker-9d2f99c7dea1.rrd:value:AVERAGE CDEF:series0=series0-def0 XPORT:series0:series0
```

The full or relative paths are passed “as is” to the RRD binding. It parses the command and performs operations on it. By looking at the RRD documentation, it seems like it's a normal behavior.

Aren't the full path the same on the host running the `rrdcached` daemon and the one running Facette?

**Comment by vaab** [comment]
> the full or relative paths are passed “as is” to the RRD binding

Yes, ``xport`` support relative and absolute paths.
And, yes, ``facette`` provides the ``path`` from the config file as-is.

But ``xport`` is run on current CWD of facette.

So the actual best way to make it work currently (provided that you corrected #240 that I can't test because of #243 ), is to have a path set to ``.`` or nothing, and run ``facette`` from the path you expect to set in the provider setting file.

I think it would be much better to give a different meaning to ``path`` (internally) whether you are in socket mode or not to remove the different meaning it has externally for the user.

I expect that:
```{
    "connector": {
        "type": "rrd",
        "path": "/my/path",
        "pattern": "(?P<source>[^/]+)/(?P<metric>.+).rrd",
        "daemon": "10.0.3.73"
    }
}
```

works the same than without ``daemon`` set or with a socket daemon.

In the current setup, only if I'm using a non-socket daemon value, I must change the path to nothing or ``.``, and run facette from the directory ``/my/path``...

And this is complicated, and I think you can do something quite easily to that by:

- checking if we are in a non-socket daemon value (are we NOT using 'unix:' in front of the string)
- in this case only, change the CWD to the value of ``path``, and make sure to send a relative path only when launching ``xport``

Am I clearer ?

**Comment by vbatoufflet** [comment]
Sure, I understand your point here.

RRD is one connector among others. And changing `CWD` of the whole Facette instance doesn't seem to fit the most common cases. When I launch a program from a specific folder, I expect from it to have its `CWD` set to this folder.

I see some problems if we try to `chdir` the process to RRD `path` value:
 * people launching Facette from a specific folder using relative paths in the main configuration file won't be able to do it anymore
 * people running Facette under Linux using `start-stop-daemon` will have their process `chdir` into `/`
 * how to handle multiple RRD providers with their own paths

I will investigate a little bit more on this, see if I can figure a way to solve this.

**Comment by vaab** [comment]
I'm not asking to change facette CWD (of course not). But only for the part launching the ``xport`` subprocess. That's the only thing that matters isn't it ?

**Comment by falzm** [comment]
@vaab Facette doesn't spawn subprocesses to execute `rrdtool xport`, we use a CGO binding linked to the librrd: https://github.com/ziutek/rrd

**Comment by vaab** [comment]
I don't know anything about ``go``, but what could prevent you from changing CWD before calling the ``xport`` path and set it back after then ? Is there some equivalent of threads running in parallel that would prevent you from doing this ? even then, are the other part of the application using the filesystem relatively speaking ?
This must be done per ``xport`` call obviously because you could have several RRD providers configured in several different directories.

**Comment by vbatoufflet** [comment]
@vaab the problem of changing the CWD during Facette execution and put it back to its original value is that it might break filesystem browsing if multiple RRD providers run concurrently in two separate goroutines.

**Comment by vbatoufflet** [comment]
Can't be implemented as is.
